<?xml version="1.0" encoding="ISO-8859-1"?>
<cppStream
    xmlns:xsi="http://www.w3.org/2001/XMLSchema-instance"
    xsi:noNamespaceSchemaLocation="cppStream.xsd">
    <comsumer>
        <topic>fluent-newData</topic>
        <confEntry>
            <entryKey>group.id</entryKey>
            <entryValue>test_group_id</entryValue>
        </confEntry>
        <confEntry>
            <entryKey>metadata.broker.list</entryKey>
            <entryValue>kafka:9092</entryValue>
        </confEntry>
    </comsumer>
    <producer>
        <topic>rdkafkaPtest</topic>
        <confEntry>
            <entryKey>metadata.broker.list</entryKey>
            <entryValue>kafka:9092</entryValue>
        </confEntry>
    </producer>
</cppStream>
